{
  "schemaVersion": "openpapers.evaluation-result.v1",
  "kind": "offline-baseline",
  "commit": "413621146cbb6c1f59738c19ff8db2c2793b6400",
  "timestamp": "2026-09-03T12:18:58.745Z",
  "workingTreeDirty": false,
  "configuration": {
    "providerMode": "offline-fixture",
    "embeddingModel": "NOT_APPLICABLE",
    "liveProviders": false
  },
  "datasets": {
    "canonical": "canonical-retrieval-v1",
    "retrieval": "retrieval-v1",
    "extraction": "extraction-v1",
    "citation": "citation-v1"
  },
  "identity": {
    "dataset": "canonical-retrieval-v1",
    "metrics": {
      "cases": 119,
      "identityAccuracy": 1,
      "falseMergeRate": 0,
      "falseSplitRate": 0,
      "unresolvedRate": 0,
      "wrongCanonicalRate": 0
    },
    "cases": [
      {
        "expected": "work_a1a0262a54cd0bbc",
        "predicted": "work_a1a0262a54cd0bbc",
        "group": "attention-is-all-you-need",
        "unresolved": false,
        "alias": "1706.03762"
      },
      {
        "expected": "work_a1a0262a54cd0bbc",
        "predicted": "work_a1a0262a54cd0bbc",
        "group": "attention-is-all-you-need",
        "unresolved": false,
        "alias": "arXiv:1706.03762"
      },
      {
        "expected": "work_a1a0262a54cd0bbc",
        "predicted": "work_a1a0262a54cd0bbc",
        "group": "attention-is-all-you-need",
        "unresolved": false,
        "alias": "1706.03762v1"
      },
      {
        "expected": "work_a1a0262a54cd0bbc",
        "predicted": "work_a1a0262a54cd0bbc",
        "group": "attention-is-all-you-need",
        "unresolved": false,
        "alias": "https://arxiv.org/abs/1706.03762v7"
      },
      {
        "expected": "work_a1a0262a54cd0bbc",
        "predicted": "work_a1a0262a54cd0bbc",
        "group": "attention-is-all-you-need",
        "unresolved": false,
        "alias": "https://www.arxiv.org/pdf/1706.03762v1.pdf"
      },
      {
        "expected": "work_955cabf3213dc361",
        "predicted": "work_955cabf3213dc361",
        "group": "bert",
        "unresolved": false,
        "alias": "1810.04805"
      },
      {
        "expected": "work_955cabf3213dc361",
        "predicted": "work_955cabf3213dc361",
        "group": "bert",
        "unresolved": false,
        "alias": "arXiv:1810.04805"
      },
      {
        "expected": "work_955cabf3213dc361",
        "predicted": "work_955cabf3213dc361",
        "group": "bert",
        "unresolved": false,
        "alias": "1810.04805v1"
      },
      {
        "expected": "work_955cabf3213dc361",
        "predicted": "work_955cabf3213dc361",
        "group": "bert",
        "unresolved": false,
        "alias": "https://arxiv.org/abs/1810.04805v7"
      },
      {
        "expected": "work_955cabf3213dc361",
        "predicted": "work_955cabf3213dc361",
        "group": "bert",
        "unresolved": false,
        "alias": "https://www.arxiv.org/pdf/1810.04805v1.pdf"
      },
      {
        "expected": "work_49ea3576b0f1a44a",
        "predicted": "work_49ea3576b0f1a44a",
        "group": "gpt3",
        "unresolved": false,
        "alias": "2005.14165"
      },
      {
        "expected": "work_49ea3576b0f1a44a",
        "predicted": "work_49ea3576b0f1a44a",
        "group": "gpt3",
        "unresolved": false,
        "alias": "arXiv:2005.14165"
      },
      {
        "expected": "work_49ea3576b0f1a44a",
        "predicted": "work_49ea3576b0f1a44a",
        "group": "gpt3",
        "unresolved": false,
        "alias": "2005.14165v1"
      },
      {
        "expected": "work_49ea3576b0f1a44a",
        "predicted": "work_49ea3576b0f1a44a",
        "group": "gpt3",
        "unresolved": false,
        "alias": "https://arxiv.org/abs/2005.14165v7"
      },
      {
        "expected": "work_49ea3576b0f1a44a",
        "predicted": "work_49ea3576b0f1a44a",
        "group": "gpt3",
        "unresolved": false,
        "alias": "https://www.arxiv.org/pdf/2005.14165v1.pdf"
      },
      {
        "expected": "work_72496ff2f98e79f5",
        "predicted": "work_72496ff2f98e79f5",
        "group": "llama",
        "unresolved": false,
        "alias": "2302.13971"
      },
      {
        "expected": "work_72496ff2f98e79f5",
        "predicted": "work_72496ff2f98e79f5",
        "group": "llama",
        "unresolved": false,
        "alias": "arXiv:2302.13971"
      },
      {
        "expected": "work_72496ff2f98e79f5",
        "predicted": "work_72496ff2f98e79f5",
        "group": "llama",
        "unresolved": false,
        "alias": "2302.13971v1"
      },
      {
        "expected": "work_72496ff2f98e79f5",
        "predicted": "work_72496ff2f98e79f5",
        "group": "llama",
        "unresolved": false,
        "alias": "https://arxiv.org/abs/2302.13971v7"
      },
      {
        "expected": "work_72496ff2f98e79f5",
        "predicted": "work_72496ff2f98e79f5",
        "group": "llama",
        "unresolved": false,
        "alias": "https://www.arxiv.org/pdf/2302.13971v1.pdf"
      },
      {
        "expected": "work_b85d9dbf9c291e18",
        "predicted": "work_b85d9dbf9c291e18",
        "group": "lora",
        "unresolved": false,
        "alias": "2106.09685"
      },
      {
        "expected": "work_b85d9dbf9c291e18",
        "predicted": "work_b85d9dbf9c291e18",
        "group": "lora",
        "unresolved": false,
        "alias": "arXiv:2106.09685"
      },
      {
        "expected": "work_b85d9dbf9c291e18",
        "predicted": "work_b85d9dbf9c291e18",
        "group": "lora",
        "unresolved": false,
        "alias": "2106.09685v1"
      },
      {
        "expected": "work_b85d9dbf9c291e18",
        "predicted": "work_b85d9dbf9c291e18",
        "group": "lora",
        "unresolved": false,
        "alias": "https://arxiv.org/abs/2106.09685v7"
      },
      {
        "expected": "work_b85d9dbf9c291e18",
        "predicted": "work_b85d9dbf9c291e18",
        "group": "lora",
        "unresolved": false,
        "alias": "https://www.arxiv.org/pdf/2106.09685v1.pdf"
      },
      {
        "expected": "work_5324ffa2c26905b3",
        "predicted": "work_5324ffa2c26905b3",
        "group": "qlora",
        "unresolved": false,
        "alias": "2305.14314"
      },
      {
        "expected": "work_5324ffa2c26905b3",
        "predicted": "work_5324ffa2c26905b3",
        "group": "qlora",
        "unresolved": false,
        "alias": "arXiv:2305.14314"
      },
      {
        "expected": "work_5324ffa2c26905b3",
        "predicted": "work_5324ffa2c26905b3",
        "group": "qlora",
        "unresolved": false,
        "alias": "2305.14314v1"
      },
      {
        "expected": "work_5324ffa2c26905b3",
        "predicted": "work_5324ffa2c26905b3",
        "group": "qlora",
        "unresolved": false,
        "alias": "https://arxiv.org/abs/2305.14314v7"
      },
      {
        "expected": "work_5324ffa2c26905b3",
        "predicted": "work_5324ffa2c26905b3",
        "group": "qlora",
        "unresolved": false,
        "alias": "https://www.arxiv.org/pdf/2305.14314v1.pdf"
      },
      {
        "expected": "work_976ad908d42d911b",
        "predicted": "work_976ad908d42d911b",
        "group": "flashattention",
        "unresolved": false,
        "alias": "2205.14135"
      },
      {
        "expected": "work_976ad908d42d911b",
        "predicted": "work_976ad908d42d911b",
        "group": "flashattention",
        "unresolved": false,
        "alias": "arXiv:2205.14135"
      },
      {
        "expected": "work_976ad908d42d911b",
        "predicted": "work_976ad908d42d911b",
        "group": "flashattention",
        "unresolved": false,
        "alias": "2205.14135v1"
      },
      {
        "expected": "work_976ad908d42d911b",
        "predicted": "work_976ad908d42d911b",
        "group": "flashattention",
        "unresolved": false,
        "alias": "https://arxiv.org/abs/2205.14135v7"
      },
      {
        "expected": "work_976ad908d42d911b",
        "predicted": "work_976ad908d42d911b",
        "group": "flashattention",
        "unresolved": false,
        "alias": "https://www.arxiv.org/pdf/2205.14135v1.pdf"
      },
      {
        "expected": "work_3bdad22db8b074df",
        "predicted": "work_3bdad22db8b074df",
        "group": "dpo",
        "unresolved": false,
        "alias": "2305.18290"
      },
      {
        "expected": "work_3bdad22db8b074df",
        "predicted": "work_3bdad22db8b074df",
        "group": "dpo",
        "unresolved": false,
        "alias": "arXiv:2305.18290"
      },
      {
        "expected": "work_3bdad22db8b074df",
        "predicted": "work_3bdad22db8b074df",
        "group": "dpo",
        "unresolved": false,
        "alias": "2305.18290v1"
      },
      {
        "expected": "work_3bdad22db8b074df",
        "predicted": "work_3bdad22db8b074df",
        "group": "dpo",
        "unresolved": false,
        "alias": "https://arxiv.org/abs/2305.18290v7"
      },
      {
        "expected": "work_3bdad22db8b074df",
        "predicted": "work_3bdad22db8b074df",
        "group": "dpo",
        "unresolved": false,
        "alias": "https://www.arxiv.org/pdf/2305.18290v1.pdf"
      },
      {
        "expected": "work_3db5d6953d170181",
        "predicted": "work_3db5d6953d170181",
        "group": "orpo",
        "unresolved": false,
        "alias": "2403.07691"
      },
      {
        "expected": "work_3db5d6953d170181",
        "predicted": "work_3db5d6953d170181",
        "group": "orpo",
        "unresolved": false,
        "alias": "arXiv:2403.07691"
      },
      {
        "expected": "work_3db5d6953d170181",
        "predicted": "work_3db5d6953d170181",
        "group": "orpo",
        "unresolved": false,
        "alias": "2403.07691v1"
      },
      {
        "expected": "work_3db5d6953d170181",
        "predicted": "work_3db5d6953d170181",
        "group": "orpo",
        "unresolved": false,
        "alias": "https://arxiv.org/abs/2403.07691v7"
      },
      {
        "expected": "work_3db5d6953d170181",